<?xml version="1.0" encoding="utf-8"?>
<!DOCTYPE entity SYSTEM
    "https://github.com/nibralab/joomla-architecture/blob/master/code/Joomla/ORM/Definition/entity.dtd">
<entity name="Detail">

    <fields>
        <field name="id" type="id"/>
        <field name="field_1" type="text" default=""/>
        <field name="field_2" type="text" default=""/>
    </fields>

    <relations>
        <belongsTo
            name="master_id"
            entity="Master"
        />
        <hasOne
            name="extra"
            entity="Extra"
            reference="detail_id"
        />
    </relations>

</entity>
