<?xml version="1.0" encoding="utf-8"?>
<!DOCTYPE entity SYSTEM
    "https://github.com/nibralab/joomla-architecture/blob/master/code/Joomla/ORM/Definition/entity.dtd">
<entity name="Joomla\Tests\Unit\ORM\Mocks\Article">

    <storage>
        <default table="articles"/>
    </storage>

    <fields>
        <field name="id"
               type="id"
               label="JGLOBAL_FIELD_ID_LABEL"
               description="JGLOBAL_FIELD_ID_DESC"
               default="null"
        >
            <validation rule="positive"/>
            <validation rule="integer"/>
        </field>

        <field name="title"
               type="title"
               label="JGLOBAL_TITLE"
        >
            <validation rule="maxlen" value="64"/>
        </field>

        <field name="teaser"
               type="richtext"
        />

        <field name="body"
               type="richtext"
        />

        <field name="author"
               type="text"
               default=""
        />

        <field name="license"
               type="text"
        >
            <validation rule="regex" value="copy(right|left)"/>
        </field>

    </fields>

    <relations>
        <belongsTo name="parent_id"
                   entity="Article"
        />
        <hasMany name="children"
                 entity="Article"
                 reference="parent_id"
        />
    </relations>

</entity>
